{
  "id": "11111111-1111-1111-1111-111111111111",
  "created_at": "2026-10-03T10:00:00Z",
  "expires_at": "2026-10-03T10:05:00Z",
  "nonce": "nonce-clean-transfer-001",
  "intent_type": "transfer",
  "source_account": "acct-001-2345",
  "amount": {
    "value": "50.00",
    "currency": "SGD"
  },
  "confidence": 0.95,
  "unresolved": [],
  "transcript": "Send fifty dollars to John Smith.",
  "payee": {
    "id": "payee-001",
    "display_name": "John Smith",
    "masked_account": "****1234"
  }
}
