{
  "id": "55555555-5555-5555-5555-555555555555",
  "created_at": "2026-10-03T13:00:00Z",
  "expires_at": "2026-10-03T13:05:00Z",
  "nonce": "nonce-over-limit-001",
  "intent_type": "transfer",
  "source_account": "acct-001-2345",
  "amount": {
    "value": "999999.00",
    "currency": "SGD"
  },
  "confidence": 0.97,
  "unresolved": [],
  "transcript": "Send nine hundred ninety-nine thousand nine hundred ninety-nine dollars to John Smith.",
  "payee": {
    "id": "payee-001",
    "display_name": "John Smith",
    "masked_account": "****1234"
  }
}
